funny,user_id,review_id,text,business_id,stars,date,useful,cool
0,9bJ6j0zrV1XSiSnzQWM5Tw,mT6U5lujK_zIcIqux92seA,"Great fresh food and clean restaurant. Friendly and very accommodating staff. I'm a frequent visitor. This is a sister restaurant to PF Chang's, but without the formality or higher prices. Great place to eat if you want the same style foods as PF Chang's, but a more laid back environment without the need to dress up or spend more.",jQsNFOzDpxPmOurSWCg1vQ,4,2016-06-19,1,0
0,8nCmV4RMwf4GpaN-A_2Tfw,YxAxExTdWtdMhEb14RGFRg,"This is pretty good. My wife and I usually split lettuce wraps and an entree of some sort. It's convenient to be able to order take out online. Overall, if I'm really in the mood for chinese food I'm going to make the drive a little further out to Big Buddha on Greenway and the 303, but this is a good substitute as it's about 1 minute from my house.",jQsNFOzDpxPmOurSWCg1vQ,3,2012-08-23,0,0
1,tbAQMMVlhxvXhe6KifrZ-A,ue6ts-gA9khywe76lEL1Kg,"Food is good and consistent and the service is always great. I've never dined in, but get take-out fairly often. I love being able to just say ""same as last time"" when I call it in. Not as good as PF Changs, but certainly better than most other Asian-ish places in Surprise. Be aware that they use shitake mushrooms is almost everything, but they are fine with custom orders if you don't want them. All in all, it's not my favorite place, but I always enjoy it every time.",jQsNFOzDpxPmOurSWCg1vQ,4,2009-06-25,2,1
0,1s0Q1KwGpJIKvD-SRSpwjw,WsTYqsyNyUd7xpwFrgwI0g,"The hubs and I dined at the Glendale location about two years ago. i guess we were hoping it was like PF Chang's....but unfortunately were dissapointed.

We discovered the Surprise location a couple weeks ago and decided that tonight we would grab a quick bite. The hubs ordered Mongolian Beef (his fav at PF Chang's) and I ordered my ""tried and true"" Ginger Broccoli and Chicken."" Of course we started with the Lettuce Wraps because honestly...they are just the most delicious things ever!

Tonight we were pleasantly suprised that the food was quite delicious. Although the dishes are EXACTLY like what you would get at PF Chang's they are scrumptous in their own right. The only downfall is that the noise isn't conducive to conversation.  I haven't been to an establishment this noisy since Buca de Beppo's...which I love (don't get me wrong)!  But I will say (on a positive note) that the customer service is fabulous! Something that can be hard to come by at times...

As for price....$28 bucks for the two of us including an appetizer, two entrees and two drinks. (coke and iced tea...with free refills) Seems a bit pricy to me but honestly....EVERYTHING is expensive now days. 

Overall, try it out...they offer take out too so you can enjoy great food in the comfort of your home....without all the noise! (or they have a patio you can dine from)",jQsNFOzDpxPmOurSWCg1vQ,4,2008-10-06,0,0
1,-0kiduTUToVYFqN_NEqMSw,g9yv-M3kvOQFPyJHCjUrdg,"Very clean and staff is always friendly. I usually order the honey seared chicken but decided to switch it up. I ordered the Thai dynamite and it had a weird, almost chemical taste. I will go back but will stick to my usual order.",jQsNFOzDpxPmOurSWCg1vQ,3,2015-03-17,2,1
0,KrQ_dWOBn2voaQLNv7hj8A,fk8OI26dAhQfot46T_SXWg,"If I could give no stars I would. My family placed an order to be picked up and were told to be there at 7:20. We get there and I sit waiting for the food until 8! Nobody acted like it was a big deal when I told them and just said ""oh.... Well we are running behind."" Um okay?! We get home and they forgot to put the crab puffs in my bag. Didn't bother going back and moved on to our meals. My honey glazed chicken was average, edible. My husbands sweet and sour chicken was so soggy it was disgusting! Couldn't even eat it. My daughter loves fried rice and wouldn't even eat hers, it was so greasy. We all ended up eating PB&J's and it was 100x better than anything we brought home.",jQsNFOzDpxPmOurSWCg1vQ,1,2014-04-22,0,0
0,2L_1kyJDOkEaPDiBRohx9w,ld06EwR5YyutWxud9ude0Q,"I went to Surprise Pei Wei Restuarant tonight on Bell.  This was my first visit to a Pei Wei.  I was very impressed with the atmosphere, food and staff.  The chicken teriyaki with fried rice was DELICIOUS.  The spring rolls were delicious too!  Your Pei Wei location is my new fav restaurant..",jQsNFOzDpxPmOurSWCg1vQ,5,2016-05-07,0,0
0,xlkjaJUu2fVojeaaVgQPOw,CxVx2FD73kw--RuzXL_RVA,I like Pei Wei overall and enjoy their varied menu selections.  The food is good and fresh.  Sometimes it's hard to find a place to sit though.,jQsNFOzDpxPmOurSWCg1vQ,4,2014-05-03,1,1
1,alTlRb9qMBX11pARX05Big,jJaU6pbKkYgl15P-5zfg3A,"Everything was good except Thai chicken wraps. Too much cilantro, absolute overkill. I think long stems is just yucky, cut them off!! Korean beef was ok but just missed the flavor I'm used to in this dish. Service is always spot on.",jQsNFOzDpxPmOurSWCg1vQ,3,2014-05-29,0,1
0,e--whH51bx5mDaMo3aJ-hg,7M2GCeIba1uTJMJbVO7TKw,"I really don't understand how anyone can eat the food from here.  Granted, I am Chinese and enjoy authentic food, however I like good Chinese American food.  For someone who usually doesn't leave food on her plate unless it is really bad, I could not finish my meal because it was tasteless and below average.",jQsNFOzDpxPmOurSWCg1vQ,1,2009-12-10,1,0
0,Ns0hZ0xDOuVRMpHk0Q-5Yw,pxs5biP-IzmjXZpoh-iVHg,"Went in for lunch with a coworker today. The small portions are overpriced and really aren't small-half would've been more than enough. 
We were served quickly and the staff was friendly! The restaurant was clean and tables were bussed quickly. 
I was disappointed with my Mongolian chicken. It tasted more like Teriyaki and was swimming in sauce. I had at least a 1/3 cup of sauce left on my plate after eating my food.
All in all, PeiWei's food will be why I don't return anytime soon even though their staff was excellent and so was the atmosphere.",jQsNFOzDpxPmOurSWCg1vQ,2,2014-10-01,0,0
0,SM20gx7YH0GtI5JOXhfXdg,DW0B2tlav4Z7T1DTzAL7kQ,"The food is great and customer service is the best! The Dan Dan noodles are dynamite but they come standard pretty spicy...  I placed a pick up order by phone and asked for them to be mild, but they ended up being  spicy!  When I got home and tried to eat them they were too spicy.  I called in and spoke to the manager and he took care of it completely and replaced the order for me at no charge!",jQsNFOzDpxPmOurSWCg1vQ,5,2015-07-13,1,0
0,R-kL1bocHgP4GW7Mgd-ZXA,nI2rhDM2CgNazMdhiODoRQ,"OH MY GOD, this place. I used to like Pei Wei until I moved to Surprise and this location ruined it for me. They consistently screw up on orders, have huge wait times, and run out of key ingredients on an alarmingly regular basis. We just spent an hour waiting for a take out order (kung pao veggies and vegetable fried rice), which was twice the time they quoted us, only to be told they were out of WHITE RICE (how does a chinese restaurant fail to foresee the possibility that they might serve a lot of white rice on a Saturday night?!). I may have chosen to stick around the extra 15 minutes if they hadn't already had to re-make half my order after making it incorrectly the first time. When I change up an order even slightly to accommodate for allergies/dietary needs, they have to re-make it at least 75% of the time.
If the food was consistently delicious, I'd rate it higher, but honestly, it's only okay.",jQsNFOzDpxPmOurSWCg1vQ,2,2016-02-14,0,0
